Rarity,Color,Cost,Title,Power,Health,Type,SubType,Text,Exp,Legendary,Land Average Percentage to Hit,Charges,Generates,Artist,Reminders
S,U,3,Yanling's Sparrow,1,2,Creature,Bird,"Flying
Debut: Summon a copy of this creature.",YAN,,,,,Yangtian Li,"Flying;Debut"
S,U,5,River Dragon,4,3,Creature,Dragon,"Flying
Debut: Give other friendly creatures +1/+0.",YAN,,,,,Ben Maier,"Flying;Debut"
S,U,1,Guard the Flock,,,Trap,,"If a friendly creature is targeted by your opponent, counter that spell or effect.",YAN,,,,,Yangtian Li,"Counter;Trap"
S,U,,Tempest's Insight,,,Special,,"If two or more friendly attacking creatures damage your opponent, draw a card.",YAN,,,,,,
S,U,,Splash of Color (Yanling),,,Deckbuilding,,Your deck can have up to 6 cards of a second color.,YAN,,,,,,
